[2025-12-02 22:40:15] ============================================================
[2025-12-02 22:40:15] MediSwitch Drug Scraper - Starting
[2025-12-02 22:40:15] ============================================================
[2025-12-02 22:40:15] Attempting to login...
[2025-12-02 22:40:16] ✓ Credentials verified for user: محمود لطي
[2025-12-02 22:40:16] ✓ Session established successfully.
[2025-12-02 22:40:16] Starting data scraping...
[2025-12-02 22:40:16] ✓ Total records available: 25453
[2025-12-02 22:40:16] ✓ Fetched batch 1: 100 records (Total: 100/25453)
[2025-12-02 22:40:16] 💾 Auto-saved 100 records to meds_updated.csv (Batch 1)
[2025-12-02 22:40:19] ✓ Fetched batch 2: 100 records (Total: 200/25453)
[2025-12-02 22:40:19] 💾 Auto-saved 200 records to meds_updated.csv (Batch 2)
[2025-12-02 22:40:23] ✓ Fetched batch 3: 100 records (Total: 300/25453)
[2025-12-02 22:40:23] 💾 Auto-saved 300 records to meds_updated.csv (Batch 3)
[2025-12-02 22:40:26] ✓ Fetched batch 4: 100 records (Total: 400/25453)
[2025-12-02 22:40:26] 💾 Auto-saved 400 records to meds_updated.csv (Batch 4)
[2025-12-02 22:40:29] ✓ Fetched batch 5: 100 records (Total: 500/25453)
[2025-12-02 22:40:29] 💾 Auto-saved 500 records to meds_updated.csv (Batch 5)
[2025-12-02 22:40:33] ✓ Fetched batch 6: 100 records (Total: 600/25453)
[2025-12-02 22:40:33] 💾 Auto-saved 600 records to meds_updated.csv (Batch 6)
[2025-12-02 22:40:37] ✓ Fetched batch 7: 100 records (Total: 700/25453)
[2025-12-02 22:40:37] 💾 Auto-saved 700 records to meds_updated.csv (Batch 7)
[2025-12-02 22:40:41] ✓ Fetched batch 8: 100 records (Total: 800/25453)
[2025-12-02 22:40:41] 💾 Auto-saved 800 records to meds_updated.csv (Batch 8)
[2025-12-02 22:40:47] ✓ Fetched batch 9: 100 records (Total: 900/25453)
[2025-12-02 22:40:47] 💾 Auto-saved 900 records to meds_updated.csv (Batch 9)
[2025-12-02 22:40:47]  Taking a longer break (10.6s) to simulate natural behavior...
[2025-12-02 22:40:58] ✓ Fetched batch 10: 100 records (Total: 1000/25453)
[2025-12-02 22:40:58] 💾 Auto-saved 1000 records to meds_updated.csv (Batch 10)
[2025-12-02 22:41:02] ✓ Fetched batch 11: 100 records (Total: 1100/25453)
[2025-12-02 22:41:02] 💾 Auto-saved 1100 records to meds_updated.csv (Batch 11)
[2025-12-02 22:41:04] ✓ Fetched batch 12: 100 records (Total: 1200/25453)
[2025-12-02 22:41:04] 💾 Auto-saved 1200 records to meds_updated.csv (Batch 12)
[2025-12-02 22:41:09] ✓ Fetched batch 13: 100 records (Total: 1300/25453)
[2025-12-02 22:41:09] 💾 Auto-saved 1300 records to meds_updated.csv (Batch 13)
[2025-12-02 22:41:13] ✓ Fetched batch 14: 100 records (Total: 1400/25453)
[2025-12-02 22:41:13] 💾 Auto-saved 1400 records to meds_updated.csv (Batch 14)
[2025-12-02 22:41:15] ✓ Fetched batch 15: 100 records (Total: 1500/25453)
[2025-12-02 22:41:15] 💾 Auto-saved 1500 records to meds_updated.csv (Batch 15)
[2025-12-02 22:41:18] ✓ Fetched batch 16: 100 records (Total: 1600/25453)
[2025-12-02 22:41:18] 💾 Auto-saved 1600 records to meds_updated.csv (Batch 16)
[2025-12-02 22:41:21] ✓ Fetched batch 17: 100 records (Total: 1700/25453)
[2025-12-02 22:41:21] 💾 Auto-saved 1700 records to meds_updated.csv (Batch 17)
[2025-12-02 22:41:23] ✓ Fetched batch 18: 100 records (Total: 1800/25453)
[2025-12-02 22:41:23] 💾 Auto-saved 1800 records to meds_updated.csv (Batch 18)
[2025-12-02 22:41:27] ✓ Fetched batch 19: 100 records (Total: 1900/25453)
[2025-12-02 22:41:27] 💾 Auto-saved 1900 records to meds_updated.csv (Batch 19)
[2025-12-02 22:41:27]  Taking a longer break (8.4s) to simulate natural behavior...
[2025-12-02 22:41:36] ✓ Fetched batch 20: 100 records (Total: 2000/25453)
[2025-12-02 22:41:36] 💾 Auto-saved 2000 records to meds_updated.csv (Batch 20)
[2025-12-02 22:41:38] ✓ Fetched batch 21: 100 records (Total: 2100/25453)
[2025-12-02 22:41:38] 💾 Auto-saved 2100 records to meds_updated.csv (Batch 21)
[2025-12-02 22:41:43] ✓ Fetched batch 22: 100 records (Total: 2200/25453)
[2025-12-02 22:41:43] 💾 Auto-saved 2200 records to meds_updated.csv (Batch 22)
[2025-12-02 22:41:46] ✓ Fetched batch 23: 100 records (Total: 2300/25453)
[2025-12-02 22:41:46] 💾 Auto-saved 2300 records to meds_updated.csv (Batch 23)
[2025-12-02 22:41:50] ✓ Fetched batch 24: 100 records (Total: 2400/25453)
[2025-12-02 22:41:50] 💾 Auto-saved 2400 records to meds_updated.csv (Batch 24)
[2025-12-02 22:41:53] ✓ Fetched batch 25: 100 records (Total: 2500/25453)
[2025-12-02 22:41:53] 💾 Auto-saved 2500 records to meds_updated.csv (Batch 25)
[2025-12-02 22:41:56] ✓ Fetched batch 26: 100 records (Total: 2600/25453)
[2025-12-02 22:41:56] 💾 Auto-saved 2600 records to meds_updated.csv (Batch 26)
[2025-12-02 22:42:00] ✓ Fetched batch 27: 100 records (Total: 2700/25453)
[2025-12-02 22:42:00] 💾 Auto-saved 2700 records to meds_updated.csv (Batch 27)
[2025-12-02 22:42:03] ✓ Fetched batch 28: 100 records (Total: 2800/25453)
[2025-12-02 22:42:03] 💾 Auto-saved 2800 records to meds_updated.csv (Batch 28)
[2025-12-02 22:42:06] ✓ Fetched batch 29: 100 records (Total: 2900/25453)
[2025-12-02 22:42:06] 💾 Auto-saved 2900 records to meds_updated.csv (Batch 29)
[2025-12-02 22:42:06]  Taking a longer break (8.9s) to simulate natural behavior...
[2025-12-02 22:42:16] ✓ Fetched batch 30: 100 records (Total: 3000/25453)
[2025-12-02 22:42:16] 💾 Auto-saved 3000 records to meds_updated.csv (Batch 30)
[2025-12-02 22:42:19] ✓ Fetched batch 31: 100 records (Total: 3100/25453)
[2025-12-02 22:42:19] 💾 Auto-saved 3100 records to meds_updated.csv (Batch 31)
[2025-12-02 22:42:22] ✓ Fetched batch 32: 100 records (Total: 3200/25453)
[2025-12-02 22:42:22] 💾 Auto-saved 3200 records to meds_updated.csv (Batch 32)
[2025-12-02 22:42:25] ✓ Fetched batch 33: 100 records (Total: 3300/25453)
[2025-12-02 22:42:25] 💾 Auto-saved 3300 records to meds_updated.csv (Batch 33)
[2025-12-02 22:42:28] ✓ Fetched batch 34: 100 records (Total: 3400/25453)
[2025-12-02 22:42:28] 💾 Auto-saved 3400 records to meds_updated.csv (Batch 34)
[2025-12-02 22:42:32] ✓ Fetched batch 35: 100 records (Total: 3500/25453)
[2025-12-02 22:42:32] 💾 Auto-saved 3500 records to meds_updated.csv (Batch 35)
[2025-12-02 22:42:35] ✓ Fetched batch 36: 100 records (Total: 3600/25453)
[2025-12-02 22:42:35] 💾 Auto-saved 3600 records to meds_updated.csv (Batch 36)
[2025-12-02 22:42:40] ✓ Fetched batch 37: 100 records (Total: 3700/25453)
[2025-12-02 22:42:40] 💾 Auto-saved 3700 records to meds_updated.csv (Batch 37)
[2025-12-02 22:42:43] ✓ Fetched batch 38: 100 records (Total: 3800/25453)
[2025-12-02 22:42:43] 💾 Auto-saved 3800 records to meds_updated.csv (Batch 38)
[2025-12-02 22:42:47] ✓ Fetched batch 39: 100 records (Total: 3900/25453)
[2025-12-02 22:42:47] 💾 Auto-saved 3900 records to meds_updated.csv (Batch 39)
[2025-12-02 22:42:47]  Taking a longer break (12.3s) to simulate natural behavior...
[2025-12-02 22:43:00] ✓ Fetched batch 40: 100 records (Total: 4000/25453)
[2025-12-02 22:43:00] 💾 Auto-saved 4000 records to meds_updated.csv (Batch 40)
[2025-12-02 22:43:03] ✓ Fetched batch 41: 100 records (Total: 4100/25453)
[2025-12-02 22:43:03] 💾 Auto-saved 4100 records to meds_updated.csv (Batch 41)
[2025-12-02 22:43:06] ✓ Fetched batch 42: 100 records (Total: 4200/25453)
[2025-12-02 22:43:06] 💾 Auto-saved 4200 records to meds_updated.csv (Batch 42)
[2025-12-02 22:43:09] ✓ Fetched batch 43: 100 records (Total: 4300/25453)
[2025-12-02 22:43:09] 💾 Auto-saved 4300 records to meds_updated.csv (Batch 43)
[2025-12-02 22:43:12] ✓ Fetched batch 44: 100 records (Total: 4400/25453)
[2025-12-02 22:43:12] 💾 Auto-saved 4400 records to meds_updated.csv (Batch 44)
[2025-12-02 22:43:15] ✓ Fetched batch 45: 100 records (Total: 4500/25453)
[2025-12-02 22:43:15] 💾 Auto-saved 4500 records to meds_updated.csv (Batch 45)
[2025-12-02 22:43:19] ✓ Fetched batch 46: 100 records (Total: 4600/25453)
[2025-12-02 22:43:19] 💾 Auto-saved 4600 records to meds_updated.csv (Batch 46)
[2025-12-02 22:43:24] ✓ Fetched batch 47: 100 records (Total: 4700/25453)
[2025-12-02 22:43:24] 💾 Auto-saved 4700 records to meds_updated.csv (Batch 47)
[2025-12-02 22:43:26] ✓ Fetched batch 48: 100 records (Total: 4800/25453)
[2025-12-02 22:43:26] 💾 Auto-saved 4800 records to meds_updated.csv (Batch 48)
[2025-12-02 22:43:31] ✓ Fetched batch 49: 100 records (Total: 4900/25453)
[2025-12-02 22:43:31] 💾 Auto-saved 4900 records to meds_updated.csv (Batch 49)
[2025-12-02 22:43:31]  Taking a longer break (14.6s) to simulate natural behavior...
[2025-12-02 22:43:46] ✓ Fetched batch 50: 100 records (Total: 5000/25453)
[2025-12-02 22:43:46] 💾 Auto-saved 5000 records to meds_updated.csv (Batch 50)
[2025-12-02 22:43:51] ✓ Fetched batch 51: 100 records (Total: 5100/25453)
[2025-12-02 22:43:51] 💾 Auto-saved 5100 records to meds_updated.csv (Batch 51)
[2025-12-02 22:43:54] ✓ Fetched batch 52: 100 records (Total: 5200/25453)
[2025-12-02 22:43:54] 💾 Auto-saved 5200 records to meds_updated.csv (Batch 52)
[2025-12-02 22:43:58] ✓ Fetched batch 53: 100 records (Total: 5300/25453)
[2025-12-02 22:43:58] 💾 Auto-saved 5300 records to meds_updated.csv (Batch 53)
[2025-12-02 22:44:03] ✓ Fetched batch 54: 100 records (Total: 5400/25453)
[2025-12-02 22:44:03] 💾 Auto-saved 5400 records to meds_updated.csv (Batch 54)
[2025-12-02 22:44:06] ✓ Fetched batch 55: 100 records (Total: 5500/25453)
[2025-12-02 22:44:07] 💾 Auto-saved 5500 records to meds_updated.csv (Batch 55)
[2025-12-02 22:44:10] ✓ Fetched batch 56: 100 records (Total: 5600/25453)
[2025-12-02 22:44:11] 💾 Auto-saved 5600 records to meds_updated.csv (Batch 56)
[2025-12-02 22:44:15] ✓ Fetched batch 57: 100 records (Total: 5700/25453)
[2025-12-02 22:44:15] 💾 Auto-saved 5700 records to meds_updated.csv (Batch 57)
[2025-12-02 22:44:18] ✓ Fetched batch 58: 100 records (Total: 5800/25453)
[2025-12-02 22:44:18] 💾 Auto-saved 5800 records to meds_updated.csv (Batch 58)
[2025-12-02 22:44:22] ✓ Fetched batch 59: 100 records (Total: 5900/25453)
[2025-12-02 22:44:22] 💾 Auto-saved 5900 records to meds_updated.csv (Batch 59)
[2025-12-02 22:44:22]  Taking a longer break (8.0s) to simulate natural behavior...
[2025-12-02 22:44:30] ✓ Fetched batch 60: 100 records (Total: 6000/25453)
[2025-12-02 22:44:30] 💾 Auto-saved 6000 records to meds_updated.csv (Batch 60)
[2025-12-02 22:44:35] ✓ Fetched batch 61: 100 records (Total: 6100/25453)
[2025-12-02 22:44:35] 💾 Auto-saved 6100 records to meds_updated.csv (Batch 61)
[2025-12-02 22:44:38] ✓ Fetched batch 62: 100 records (Total: 6200/25453)
[2025-12-02 22:44:39] 💾 Auto-saved 6200 records to meds_updated.csv (Batch 62)
[2025-12-02 22:44:43] ✓ Fetched batch 63: 100 records (Total: 6300/25453)
[2025-12-02 22:44:43] 💾 Auto-saved 6300 records to meds_updated.csv (Batch 63)
[2025-12-02 22:44:45] ✓ Fetched batch 64: 100 records (Total: 6400/25453)
[2025-12-02 22:44:45] 💾 Auto-saved 6400 records to meds_updated.csv (Batch 64)
[2025-12-02 22:44:49] ✓ Fetched batch 65: 100 records (Total: 6500/25453)
[2025-12-02 22:44:49] 💾 Auto-saved 6500 records to meds_updated.csv (Batch 65)
[2025-12-02 22:44:51] ✓ Fetched batch 66: 100 records (Total: 6600/25453)
[2025-12-02 22:44:51] 💾 Auto-saved 6600 records to meds_updated.csv (Batch 66)
[2025-12-02 22:44:55] ✓ Fetched batch 67: 100 records (Total: 6700/25453)
[2025-12-02 22:44:56] 💾 Auto-saved 6700 records to meds_updated.csv (Batch 67)
[2025-12-02 22:45:01] ✓ Fetched batch 68: 100 records (Total: 6800/25453)
[2025-12-02 22:45:01] 💾 Auto-saved 6800 records to meds_updated.csv (Batch 68)
[2025-12-02 22:45:04] ✓ Fetched batch 69: 100 records (Total: 6900/25453)
[2025-12-02 22:45:05] 💾 Auto-saved 6900 records to meds_updated.csv (Batch 69)
[2025-12-02 22:45:05]  Taking a longer break (11.9s) to simulate natural behavior...
[2025-12-02 22:45:17] ✓ Fetched batch 70: 100 records (Total: 7000/25453)
[2025-12-02 22:45:17] 💾 Auto-saved 7000 records to meds_updated.csv (Batch 70)
[2025-12-02 22:45:22] ✓ Fetched batch 71: 100 records (Total: 7100/25453)
[2025-12-02 22:45:22] 💾 Auto-saved 7100 records to meds_updated.csv (Batch 71)
[2025-12-02 22:45:25] ✓ Fetched batch 72: 100 records (Total: 7200/25453)
[2025-12-02 22:45:25] 💾 Auto-saved 7200 records to meds_updated.csv (Batch 72)
[2025-12-02 22:45:30] ✓ Fetched batch 73: 100 records (Total: 7300/25453)
[2025-12-02 22:45:30] 💾 Auto-saved 7300 records to meds_updated.csv (Batch 73)
[2025-12-02 22:45:36] ✓ Fetched batch 74: 100 records (Total: 7400/25453)
[2025-12-02 22:45:36] 💾 Auto-saved 7400 records to meds_updated.csv (Batch 74)
[2025-12-02 22:45:41] ✓ Fetched batch 75: 100 records (Total: 7500/25453)
[2025-12-02 22:45:41] 💾 Auto-saved 7500 records to meds_updated.csv (Batch 75)
[2025-12-02 22:45:47] ✓ Fetched batch 76: 100 records (Total: 7600/25453)
[2025-12-02 22:45:47] 💾 Auto-saved 7600 records to meds_updated.csv (Batch 76)
[2025-12-02 22:45:52] ✓ Fetched batch 77: 100 records (Total: 7700/25453)
[2025-12-02 22:45:52] 💾 Auto-saved 7700 records to meds_updated.csv (Batch 77)
[2025-12-02 22:45:55] ✓ Fetched batch 78: 100 records (Total: 7800/25453)
[2025-12-02 22:45:55] 💾 Auto-saved 7800 records to meds_updated.csv (Batch 78)
[2025-12-02 22:46:00] ✓ Fetched batch 79: 100 records (Total: 7900/25453)
[2025-12-02 22:46:00] 💾 Auto-saved 7900 records to meds_updated.csv (Batch 79)
[2025-12-02 22:46:00]  Taking a longer break (11.2s) to simulate natural behavior...
[2025-12-02 22:46:12] ✓ Fetched batch 80: 100 records (Total: 8000/25453)
[2025-12-02 22:46:12] 💾 Auto-saved 8000 records to meds_updated.csv (Batch 80)
[2025-12-02 22:46:16] ✓ Fetched batch 81: 100 records (Total: 8100/25453)
[2025-12-02 22:46:16] 💾 Auto-saved 8100 records to meds_updated.csv (Batch 81)
[2025-12-02 22:46:20] ✓ Fetched batch 82: 100 records (Total: 8200/25453)
[2025-12-02 22:46:20] 💾 Auto-saved 8200 records to meds_updated.csv (Batch 82)
[2025-12-02 22:46:23] ✓ Fetched batch 83: 100 records (Total: 8300/25453)
[2025-12-02 22:46:23] 💾 Auto-saved 8300 records to meds_updated.csv (Batch 83)
[2025-12-02 22:46:28] ✓ Fetched batch 84: 100 records (Total: 8400/25453)
[2025-12-02 22:46:28] 💾 Auto-saved 8400 records to meds_updated.csv (Batch 84)
[2025-12-02 22:46:32] ✓ Fetched batch 85: 100 records (Total: 8500/25453)
[2025-12-02 22:46:32] 💾 Auto-saved 8500 records to meds_updated.csv (Batch 85)
[2025-12-02 22:46:35] ✓ Fetched batch 86: 100 records (Total: 8600/25453)
[2025-12-02 22:46:35] 💾 Auto-saved 8600 records to meds_updated.csv (Batch 86)
[2025-12-02 22:46:39] ✓ Fetched batch 87: 100 records (Total: 8700/25453)
[2025-12-02 22:46:39] 💾 Auto-saved 8700 records to meds_updated.csv (Batch 87)
[2025-12-02 22:46:42] ✓ Fetched batch 88: 100 records (Total: 8800/25453)
[2025-12-02 22:46:42] 💾 Auto-saved 8800 records to meds_updated.csv (Batch 88)
[2025-12-02 22:46:47] ✓ Fetched batch 89: 100 records (Total: 8900/25453)
[2025-12-02 22:46:47] 💾 Auto-saved 8900 records to meds_updated.csv (Batch 89)
[2025-12-02 22:46:47]  Taking a longer break (11.7s) to simulate natural behavior...
[2025-12-02 22:47:00] ✓ Fetched batch 90: 100 records (Total: 9000/25453)
[2025-12-02 22:47:00] 💾 Auto-saved 9000 records to meds_updated.csv (Batch 90)
[2025-12-02 22:47:03] ✓ Fetched batch 91: 100 records (Total: 9100/25453)
[2025-12-02 22:47:03] 💾 Auto-saved 9100 records to meds_updated.csv (Batch 91)
[2025-12-02 22:47:08] ✓ Fetched batch 92: 100 records (Total: 9200/25453)
[2025-12-02 22:47:08] 💾 Auto-saved 9200 records to meds_updated.csv (Batch 92)
[2025-12-02 22:47:10] ✓ Fetched batch 93: 100 records (Total: 9300/25453)
[2025-12-02 22:47:11] 💾 Auto-saved 9300 records to meds_updated.csv (Batch 93)
[2025-12-02 22:47:14] ✓ Fetched batch 94: 100 records (Total: 9400/25453)
[2025-12-02 22:47:14] 💾 Auto-saved 9400 records to meds_updated.csv (Batch 94)
[2025-12-02 22:47:18] ✓ Fetched batch 95: 100 records (Total: 9500/25453)
[2025-12-02 22:47:19] 💾 Auto-saved 9500 records to meds_updated.csv (Batch 95)
[2025-12-02 22:47:21] ✓ Fetched batch 96: 100 records (Total: 9600/25453)
[2025-12-02 22:47:22] 💾 Auto-saved 9600 records to meds_updated.csv (Batch 96)
[2025-12-02 22:47:24] ✓ Fetched batch 97: 100 records (Total: 9700/25453)
[2025-12-02 22:47:24] 💾 Auto-saved 9700 records to meds_updated.csv (Batch 97)
[2025-12-02 22:47:27] ✓ Fetched batch 98: 100 records (Total: 9800/25453)
[2025-12-02 22:47:28] 💾 Auto-saved 9800 records to meds_updated.csv (Batch 98)
[2025-12-02 22:47:33] ✓ Fetched batch 99: 100 records (Total: 9900/25453)
[2025-12-02 22:47:33] 💾 Auto-saved 9900 records to meds_updated.csv (Batch 99)
[2025-12-02 22:47:33]  Taking a longer break (12.7s) to simulate natural behavior...
[2025-12-02 22:47:46] ✓ Fetched batch 100: 100 records (Total: 10000/25453)
[2025-12-02 22:47:46] 💾 Auto-saved 10000 records to meds_updated.csv (Batch 100)
[2025-12-02 22:47:49] ✓ Fetched batch 101: 100 records (Total: 10100/25453)
[2025-12-02 22:47:49] 💾 Auto-saved 10100 records to meds_updated.csv (Batch 101)
[2025-12-02 22:47:53] ✓ Fetched batch 102: 100 records (Total: 10200/25453)
[2025-12-02 22:47:53] 💾 Auto-saved 10200 records to meds_updated.csv (Batch 102)
[2025-12-02 22:47:56] ✓ Fetched batch 103: 100 records (Total: 10300/25453)
[2025-12-02 22:47:56] 💾 Auto-saved 10300 records to meds_updated.csv (Batch 103)
[2025-12-02 22:48:01] ✓ Fetched batch 104: 100 records (Total: 10400/25453)
[2025-12-02 22:48:01] 💾 Auto-saved 10400 records to meds_updated.csv (Batch 104)
[2025-12-02 22:48:04] ✓ Fetched batch 105: 100 records (Total: 10500/25453)
[2025-12-02 22:48:04] 💾 Auto-saved 10500 records to meds_updated.csv (Batch 105)
[2025-12-02 22:48:09] ✓ Fetched batch 106: 100 records (Total: 10600/25453)
[2025-12-02 22:48:10] 💾 Auto-saved 10600 records to meds_updated.csv (Batch 106)
[2025-12-02 22:48:12] ✓ Fetched batch 107: 100 records (Total: 10700/25453)
[2025-12-02 22:48:12] 💾 Auto-saved 10700 records to meds_updated.csv (Batch 107)
[2025-12-02 22:48:18] ✓ Fetched batch 108: 100 records (Total: 10800/25453)
[2025-12-02 22:48:18] 💾 Auto-saved 10800 records to meds_updated.csv (Batch 108)
[2025-12-02 22:48:21] ✓ Fetched batch 109: 100 records (Total: 10900/25453)
[2025-12-02 22:48:22] 💾 Auto-saved 10900 records to meds_updated.csv (Batch 109)
[2025-12-02 22:48:22]  Taking a longer break (10.8s) to simulate natural behavior...
[2025-12-02 22:48:33] ✓ Fetched batch 110: 100 records (Total: 11000/25453)
[2025-12-02 22:48:33] 💾 Auto-saved 11000 records to meds_updated.csv (Batch 110)
[2025-12-02 22:48:36] ✓ Fetched batch 111: 100 records (Total: 11100/25453)
[2025-12-02 22:48:37] 💾 Auto-saved 11100 records to meds_updated.csv (Batch 111)
[2025-12-02 22:48:41] ✓ Fetched batch 112: 100 records (Total: 11200/25453)
[2025-12-02 22:48:41] 💾 Auto-saved 11200 records to meds_updated.csv (Batch 112)
[2025-12-02 22:48:45] ✓ Fetched batch 113: 100 records (Total: 11300/25453)
[2025-12-02 22:48:46] 💾 Auto-saved 11300 records to meds_updated.csv (Batch 113)
[2025-12-02 22:48:49] ✓ Fetched batch 114: 100 records (Total: 11400/25453)
[2025-12-02 22:48:50] 💾 Auto-saved 11400 records to meds_updated.csv (Batch 114)
[2025-12-02 22:48:55] ✓ Fetched batch 115: 100 records (Total: 11500/25453)
[2025-12-02 22:48:55] 💾 Auto-saved 11500 records to meds_updated.csv (Batch 115)
[2025-12-02 22:48:59] ✓ Fetched batch 116: 100 records (Total: 11600/25453)
[2025-12-02 22:48:59] 💾 Auto-saved 11600 records to meds_updated.csv (Batch 116)
[2025-12-02 22:49:04] ✓ Fetched batch 117: 100 records (Total: 11700/25453)
[2025-12-02 22:49:04] 💾 Auto-saved 11700 records to meds_updated.csv (Batch 117)
[2025-12-02 22:49:07] ✓ Fetched batch 118: 100 records (Total: 11800/25453)
[2025-12-02 22:49:08] 💾 Auto-saved 11800 records to meds_updated.csv (Batch 118)
[2025-12-02 22:49:13] ✓ Fetched batch 119: 100 records (Total: 11900/25453)
[2025-12-02 22:49:13] 💾 Auto-saved 11900 records to meds_updated.csv (Batch 119)
[2025-12-02 22:49:13]  Taking a longer break (11.3s) to simulate natural behavior...
[2025-12-02 22:49:25] ✓ Fetched batch 120: 100 records (Total: 12000/25453)
[2025-12-02 22:49:25] 💾 Auto-saved 12000 records to meds_updated.csv (Batch 120)
[2025-12-02 22:49:29] ✓ Fetched batch 121: 100 records (Total: 12100/25453)
[2025-12-02 22:49:30] 💾 Auto-saved 12100 records to meds_updated.csv (Batch 121)
[2025-12-02 22:49:33] ✓ Fetched batch 122: 100 records (Total: 12200/25453)
[2025-12-02 22:49:33] 💾 Auto-saved 12200 records to meds_updated.csv (Batch 122)
[2025-12-02 22:49:38] ✓ Fetched batch 123: 100 records (Total: 12300/25453)
[2025-12-02 22:49:38] 💾 Auto-saved 12300 records to meds_updated.csv (Batch 123)
[2025-12-02 22:49:43] ✓ Fetched batch 124: 100 records (Total: 12400/25453)
[2025-12-02 22:49:44] 💾 Auto-saved 12400 records to meds_updated.csv (Batch 124)
[2025-12-02 22:49:48] ✓ Fetched batch 125: 100 records (Total: 12500/25453)
[2025-12-02 22:49:49] 💾 Auto-saved 12500 records to meds_updated.csv (Batch 125)
[2025-12-02 22:49:52] ✓ Fetched batch 126: 100 records (Total: 12600/25453)
[2025-12-02 22:49:52] 💾 Auto-saved 12600 records to meds_updated.csv (Batch 126)
[2025-12-02 22:49:55] ✓ Fetched batch 127: 100 records (Total: 12700/25453)
[2025-12-02 22:49:55] 💾 Auto-saved 12700 records to meds_updated.csv (Batch 127)
[2025-12-02 22:49:59] ✓ Fetched batch 128: 100 records (Total: 12800/25453)
[2025-12-02 22:49:59] 💾 Auto-saved 12800 records to meds_updated.csv (Batch 128)
[2025-12-02 22:50:03] ✓ Fetched batch 129: 100 records (Total: 12900/25453)
[2025-12-02 22:50:03] 💾 Auto-saved 12900 records to meds_updated.csv (Batch 129)
[2025-12-02 22:50:03]  Taking a longer break (14.2s) to simulate natural behavior...
[2025-12-02 22:50:18] ✓ Fetched batch 130: 100 records (Total: 13000/25453)
[2025-12-02 22:50:18] 💾 Auto-saved 13000 records to meds_updated.csv (Batch 130)
[2025-12-02 22:50:22] ✓ Fetched batch 131: 100 records (Total: 13100/25453)
[2025-12-02 22:50:22] 💾 Auto-saved 13100 records to meds_updated.csv (Batch 131)
[2025-12-02 22:50:25] ✓ Fetched batch 132: 100 records (Total: 13200/25453)
[2025-12-02 22:50:25] 💾 Auto-saved 13200 records to meds_updated.csv (Batch 132)
[2025-12-02 22:50:29] ✓ Fetched batch 133: 100 records (Total: 13300/25453)
[2025-12-02 22:50:29] 💾 Auto-saved 13300 records to meds_updated.csv (Batch 133)
[2025-12-02 22:50:36] ✓ Fetched batch 134: 100 records (Total: 13400/25453)
[2025-12-02 22:50:36] 💾 Auto-saved 13400 records to meds_updated.csv (Batch 134)
[2025-12-02 22:50:43] ✓ Fetched batch 135: 100 records (Total: 13500/25453)
[2025-12-02 22:50:44] 💾 Auto-saved 13500 records to meds_updated.csv (Batch 135)
[2025-12-02 22:50:50] ✓ Fetched batch 136: 100 records (Total: 13600/25453)
[2025-12-02 22:50:50] 💾 Auto-saved 13600 records to meds_updated.csv (Batch 136)
[2025-12-02 22:50:55] ✓ Fetched batch 137: 100 records (Total: 13700/25453)
[2025-12-02 22:50:55] 💾 Auto-saved 13700 records to meds_updated.csv (Batch 137)
[2025-12-02 22:50:59] ✓ Fetched batch 138: 100 records (Total: 13800/25453)
[2025-12-02 22:50:59] 💾 Auto-saved 13800 records to meds_updated.csv (Batch 138)
[2025-12-02 22:51:04] ✓ Fetched batch 139: 100 records (Total: 13900/25453)
[2025-12-02 22:51:04] 💾 Auto-saved 13900 records to meds_updated.csv (Batch 139)
[2025-12-02 22:51:04]  Taking a longer break (14.3s) to simulate natural behavior...
[2025-12-02 22:51:19] ✓ Fetched batch 140: 100 records (Total: 14000/25453)
[2025-12-02 22:51:19] 💾 Auto-saved 14000 records to meds_updated.csv (Batch 140)
[2025-12-02 22:51:22] ✓ Fetched batch 141: 100 records (Total: 14100/25453)
[2025-12-02 22:51:22] 💾 Auto-saved 14100 records to meds_updated.csv (Batch 141)
[2025-12-02 22:51:27] ✓ Fetched batch 142: 100 records (Total: 14200/25453)
[2025-12-02 22:51:27] 💾 Auto-saved 14200 records to meds_updated.csv (Batch 142)
[2025-12-02 22:51:31] ✓ Fetched batch 143: 100 records (Total: 14300/25453)
[2025-12-02 22:51:32] 💾 Auto-saved 14300 records to meds_updated.csv (Batch 143)
[2025-12-02 22:51:37] ✓ Fetched batch 144: 100 records (Total: 14400/25453)
[2025-12-02 22:51:37] 💾 Auto-saved 14400 records to meds_updated.csv (Batch 144)
[2025-12-02 22:51:42] ✓ Fetched batch 145: 100 records (Total: 14500/25453)
[2025-12-02 22:51:42] 💾 Auto-saved 14500 records to meds_updated.csv (Batch 145)
[2025-12-02 22:51:47] ✓ Fetched batch 146: 100 records (Total: 14600/25453)
[2025-12-02 22:51:47] 💾 Auto-saved 14600 records to meds_updated.csv (Batch 146)
[2025-12-02 22:51:50] ✓ Fetched batch 147: 100 records (Total: 14700/25453)
[2025-12-02 22:51:50] 💾 Auto-saved 14700 records to meds_updated.csv (Batch 147)
[2025-12-02 22:51:55] ✓ Fetched batch 148: 100 records (Total: 14800/25453)
[2025-12-02 22:51:55] 💾 Auto-saved 14800 records to meds_updated.csv (Batch 148)
[2025-12-02 22:51:59] ✓ Fetched batch 149: 100 records (Total: 14900/25453)
[2025-12-02 22:51:59] 💾 Auto-saved 14900 records to meds_updated.csv (Batch 149)
[2025-12-02 22:51:59]  Taking a longer break (9.4s) to simulate natural behavior...
[2025-12-02 22:52:09] ✓ Fetched batch 150: 100 records (Total: 15000/25453)
[2025-12-02 22:52:09] 💾 Auto-saved 15000 records to meds_updated.csv (Batch 150)
[2025-12-02 22:52:14] ✓ Fetched batch 151: 100 records (Total: 15100/25453)
[2025-12-02 22:52:14] 💾 Auto-saved 15100 records to meds_updated.csv (Batch 151)
[2025-12-02 22:52:17] ✓ Fetched batch 152: 100 records (Total: 15200/25453)
[2025-12-02 22:52:17] 💾 Auto-saved 15200 records to meds_updated.csv (Batch 152)
[2025-12-02 22:52:22] ✓ Fetched batch 153: 100 records (Total: 15300/25453)
[2025-12-02 22:52:23] 💾 Auto-saved 15300 records to meds_updated.csv (Batch 153)
[2025-12-02 22:52:27] ✓ Fetched batch 154: 100 records (Total: 15400/25453)
[2025-12-02 22:52:27] 💾 Auto-saved 15400 records to meds_updated.csv (Batch 154)
[2025-12-02 22:52:32] ✓ Fetched batch 155: 100 records (Total: 15500/25453)
[2025-12-02 22:52:32] 💾 Auto-saved 15500 records to meds_updated.csv (Batch 155)
[2025-12-02 22:52:36] ✓ Fetched batch 156: 100 records (Total: 15600/25453)
[2025-12-02 22:52:36] 💾 Auto-saved 15600 records to meds_updated.csv (Batch 156)
[2025-12-02 22:52:40] ✓ Fetched batch 157: 100 records (Total: 15700/25453)
[2025-12-02 22:52:40] 💾 Auto-saved 15700 records to meds_updated.csv (Batch 157)
[2025-12-02 22:52:45] ✓ Fetched batch 158: 100 records (Total: 15800/25453)
[2025-12-02 22:52:45] 💾 Auto-saved 15800 records to meds_updated.csv (Batch 158)
[2025-12-02 22:52:51] ✓ Fetched batch 159: 100 records (Total: 15900/25453)
[2025-12-02 22:52:51] 💾 Auto-saved 15900 records to meds_updated.csv (Batch 159)
[2025-12-02 22:52:51]  Taking a longer break (9.1s) to simulate natural behavior...
[2025-12-02 22:53:00] ✓ Fetched batch 160: 100 records (Total: 16000/25453)
[2025-12-02 22:53:01] 💾 Auto-saved 16000 records to meds_updated.csv (Batch 160)
[2025-12-02 22:53:04] ✓ Fetched batch 161: 100 records (Total: 16100/25453)
[2025-12-02 22:53:04] 💾 Auto-saved 16100 records to meds_updated.csv (Batch 161)
[2025-12-02 22:53:07] ✓ Fetched batch 162: 100 records (Total: 16200/25453)
[2025-12-02 22:53:08] 💾 Auto-saved 16200 records to meds_updated.csv (Batch 162)
[2025-12-02 22:53:12] ✓ Fetched batch 163: 100 records (Total: 16300/25453)
[2025-12-02 22:53:12] 💾 Auto-saved 16300 records to meds_updated.csv (Batch 163)
[2025-12-02 22:53:16] ✓ Fetched batch 164: 100 records (Total: 16400/25453)
[2025-12-02 22:53:17] 💾 Auto-saved 16400 records to meds_updated.csv (Batch 164)
[2025-12-02 22:53:21] ✓ Fetched batch 165: 100 records (Total: 16500/25453)
[2025-12-02 22:53:21] 💾 Auto-saved 16500 records to meds_updated.csv (Batch 165)
[2025-12-02 22:53:25] ✓ Fetched batch 166: 100 records (Total: 16600/25453)
[2025-12-02 22:53:25] 💾 Auto-saved 16600 records to meds_updated.csv (Batch 166)
[2025-12-02 22:53:29] ✓ Fetched batch 167: 100 records (Total: 16700/25453)
[2025-12-02 22:53:29] 💾 Auto-saved 16700 records to meds_updated.csv (Batch 167)
[2025-12-02 22:53:32] ✓ Fetched batch 168: 100 records (Total: 16800/25453)
[2025-12-02 22:53:33] 💾 Auto-saved 16800 records to meds_updated.csv (Batch 168)
[2025-12-02 22:53:38] ✓ Fetched batch 169: 100 records (Total: 16900/25453)
[2025-12-02 22:53:38] 💾 Auto-saved 16900 records to meds_updated.csv (Batch 169)
[2025-12-02 22:53:38]  Taking a longer break (10.4s) to simulate natural behavior...
[2025-12-02 22:53:49] ✓ Fetched batch 170: 100 records (Total: 17000/25453)
[2025-12-02 22:53:49] 💾 Auto-saved 17000 records to meds_updated.csv (Batch 170)
[2025-12-02 22:53:54] ✓ Fetched batch 171: 100 records (Total: 17100/25453)
[2025-12-02 22:53:54] 💾 Auto-saved 17100 records to meds_updated.csv (Batch 171)
[2025-12-02 22:53:58] ✓ Fetched batch 172: 100 records (Total: 17200/25453)
[2025-12-02 22:53:58] 💾 Auto-saved 17200 records to meds_updated.csv (Batch 172)
[2025-12-02 22:54:01] ✓ Fetched batch 173: 100 records (Total: 17300/25453)
[2025-12-02 22:54:01] 💾 Auto-saved 17300 records to meds_updated.csv (Batch 173)
[2025-12-02 22:54:06] ✓ Fetched batch 174: 100 records (Total: 17400/25453)
[2025-12-02 22:54:06] 💾 Auto-saved 17400 records to meds_updated.csv (Batch 174)
[2025-12-02 22:54:09] ✓ Fetched batch 175: 100 records (Total: 17500/25453)
[2025-12-02 22:54:10] 💾 Auto-saved 17500 records to meds_updated.csv (Batch 175)
[2025-12-02 22:54:14] ✓ Fetched batch 176: 100 records (Total: 17600/25453)
[2025-12-02 22:54:15] 💾 Auto-saved 17600 records to meds_updated.csv (Batch 176)
[2025-12-02 22:54:19] ✓ Fetched batch 177: 100 records (Total: 17700/25453)
[2025-12-02 22:54:20] 💾 Auto-saved 17700 records to meds_updated.csv (Batch 177)
[2025-12-02 22:54:22] ✓ Fetched batch 178: 100 records (Total: 17800/25453)
[2025-12-02 22:54:23] 💾 Auto-saved 17800 records to meds_updated.csv (Batch 178)
[2025-12-02 22:54:27] ✓ Fetched batch 179: 100 records (Total: 17900/25453)
[2025-12-02 22:54:28] 💾 Auto-saved 17900 records to meds_updated.csv (Batch 179)
[2025-12-02 22:54:28]  Taking a longer break (10.8s) to simulate natural behavior...
[2025-12-02 22:54:39] ✓ Fetched batch 180: 100 records (Total: 18000/25453)
[2025-12-02 22:54:40] 💾 Auto-saved 18000 records to meds_updated.csv (Batch 180)
[2025-12-02 22:54:43] ✓ Fetched batch 181: 100 records (Total: 18100/25453)
[2025-12-02 22:54:44] 💾 Auto-saved 18100 records to meds_updated.csv (Batch 181)
[2025-12-02 22:54:48] ✓ Fetched batch 182: 100 records (Total: 18200/25453)
[2025-12-02 22:54:49] 💾 Auto-saved 18200 records to meds_updated.csv (Batch 182)
[2025-12-02 22:54:53] ✓ Fetched batch 183: 100 records (Total: 18300/25453)
[2025-12-02 22:54:53] 💾 Auto-saved 18300 records to meds_updated.csv (Batch 183)
[2025-12-02 22:54:57] ✓ Fetched batch 184: 100 records (Total: 18400/25453)
[2025-12-02 22:54:58] 💾 Auto-saved 18400 records to meds_updated.csv (Batch 184)
[2025-12-02 22:55:01] ✓ Fetched batch 185: 100 records (Total: 18500/25453)
[2025-12-02 22:55:02] 💾 Auto-saved 18500 records to meds_updated.csv (Batch 185)
[2025-12-02 22:55:06] ✓ Fetched batch 186: 100 records (Total: 18600/25453)
[2025-12-02 22:55:07] 💾 Auto-saved 18600 records to meds_updated.csv (Batch 186)
[2025-12-02 22:55:10] ✓ Fetched batch 187: 100 records (Total: 18700/25453)
[2025-12-02 22:55:10] 💾 Auto-saved 18700 records to meds_updated.csv (Batch 187)
[2025-12-02 22:55:13] ✓ Fetched batch 188: 100 records (Total: 18800/25453)
[2025-12-02 22:55:14] 💾 Auto-saved 18800 records to meds_updated.csv (Batch 188)
[2025-12-02 22:55:18] ✓ Fetched batch 189: 100 records (Total: 18900/25453)
[2025-12-02 22:55:18] 💾 Auto-saved 18900 records to meds_updated.csv (Batch 189)
[2025-12-02 22:55:18]  Taking a longer break (13.1s) to simulate natural behavior...
[2025-12-02 22:55:33] ✓ Fetched batch 190: 100 records (Total: 19000/25453)
[2025-12-02 22:55:34] 💾 Auto-saved 19000 records to meds_updated.csv (Batch 190)
[2025-12-02 22:55:40] ✓ Fetched batch 191: 100 records (Total: 19100/25453)
[2025-12-02 22:55:40] 💾 Auto-saved 19100 records to meds_updated.csv (Batch 191)
[2025-12-02 22:55:45] ✓ Fetched batch 192: 100 records (Total: 19200/25453)
[2025-12-02 22:55:46] 💾 Auto-saved 19200 records to meds_updated.csv (Batch 192)
[2025-12-02 22:55:50] ✓ Fetched batch 193: 100 records (Total: 19300/25453)
[2025-12-02 22:55:51] 💾 Auto-saved 19300 records to meds_updated.csv (Batch 193)
[2025-12-02 22:55:56] ✓ Fetched batch 194: 100 records (Total: 19400/25453)
[2025-12-02 22:55:56] 💾 Auto-saved 19400 records to meds_updated.csv (Batch 194)
[2025-12-02 22:56:01] ✓ Fetched batch 195: 100 records (Total: 19500/25453)
[2025-12-02 22:56:02] 💾 Auto-saved 19500 records to meds_updated.csv (Batch 195)
[2025-12-02 22:56:06] ✓ Fetched batch 196: 100 records (Total: 19600/25453)
[2025-12-02 22:56:06] 💾 Auto-saved 19600 records to meds_updated.csv (Batch 196)
[2025-12-02 22:56:09] ✓ Fetched batch 197: 100 records (Total: 19700/25453)
[2025-12-02 22:56:09] 💾 Auto-saved 19700 records to meds_updated.csv (Batch 197)
[2025-12-02 22:56:15] ✓ Fetched batch 198: 100 records (Total: 19800/25453)
[2025-12-02 22:56:15] 💾 Auto-saved 19800 records to meds_updated.csv (Batch 198)
[2025-12-02 22:56:18] ✓ Fetched batch 199: 100 records (Total: 19900/25453)
[2025-12-02 22:56:19] 💾 Auto-saved 19900 records to meds_updated.csv (Batch 199)
[2025-12-02 22:56:19]  Taking a longer break (10.6s) to simulate natural behavior...
[2025-12-02 22:56:30] ✓ Fetched batch 200: 100 records (Total: 20000/25453)
[2025-12-02 22:56:31] 💾 Auto-saved 20000 records to meds_updated.csv (Batch 200)
[2025-12-02 22:56:35] ✓ Fetched batch 201: 100 records (Total: 20100/25453)
[2025-12-02 22:56:36] 💾 Auto-saved 20100 records to meds_updated.csv (Batch 201)
[2025-12-02 22:56:39] ✓ Fetched batch 202: 100 records (Total: 20200/25453)
[2025-12-02 22:56:40] 💾 Auto-saved 20200 records to meds_updated.csv (Batch 202)
[2025-12-02 22:56:44] ✓ Fetched batch 203: 100 records (Total: 20300/25453)
[2025-12-02 22:56:44] 💾 Auto-saved 20300 records to meds_updated.csv (Batch 203)
[2025-12-02 22:56:50] ✓ Fetched batch 204: 100 records (Total: 20400/25453)
[2025-12-02 22:56:50] 💾 Auto-saved 20400 records to meds_updated.csv (Batch 204)
[2025-12-02 22:56:55] ✓ Fetched batch 205: 100 records (Total: 20500/25453)
[2025-12-02 22:56:55] 💾 Auto-saved 20500 records to meds_updated.csv (Batch 205)
[2025-12-02 22:56:59] ✓ Fetched batch 206: 100 records (Total: 20600/25453)
[2025-12-02 22:57:00] 💾 Auto-saved 20600 records to meds_updated.csv (Batch 206)
[2025-12-02 22:57:02] ✓ Fetched batch 207: 100 records (Total: 20700/25453)
[2025-12-02 22:57:03] 💾 Auto-saved 20700 records to meds_updated.csv (Batch 207)
[2025-12-02 22:57:08] ✓ Fetched batch 208: 100 records (Total: 20800/25453)
[2025-12-02 22:57:08] 💾 Auto-saved 20800 records to meds_updated.csv (Batch 208)
[2025-12-02 22:57:13] ✓ Fetched batch 209: 100 records (Total: 20900/25453)
[2025-12-02 22:57:13] 💾 Auto-saved 20900 records to meds_updated.csv (Batch 209)
[2025-12-02 22:57:13]  Taking a longer break (12.4s) to simulate natural behavior...
[2025-12-02 22:57:26] ✓ Fetched batch 210: 100 records (Total: 21000/25453)
[2025-12-02 22:57:27] 💾 Auto-saved 21000 records to meds_updated.csv (Batch 210)
[2025-12-02 22:57:30] ✓ Fetched batch 211: 100 records (Total: 21100/25453)
[2025-12-02 22:57:30] 💾 Auto-saved 21100 records to meds_updated.csv (Batch 211)
[2025-12-02 22:57:33] ✓ Fetched batch 212: 100 records (Total: 21200/25453)
[2025-12-02 22:57:34] 💾 Auto-saved 21200 records to meds_updated.csv (Batch 212)
[2025-12-02 22:57:36] ✓ Fetched batch 213: 100 records (Total: 21300/25453)
[2025-12-02 22:57:37] 💾 Auto-saved 21300 records to meds_updated.csv (Batch 213)
[2025-12-02 22:57:41] ✓ Fetched batch 214: 100 records (Total: 21400/25453)
[2025-12-02 22:57:42] 💾 Auto-saved 21400 records to meds_updated.csv (Batch 214)
[2025-12-02 22:57:46] ✓ Fetched batch 215: 100 records (Total: 21500/25453)
[2025-12-02 22:57:46] 💾 Auto-saved 21500 records to meds_updated.csv (Batch 215)
[2025-12-02 22:57:50] ✓ Fetched batch 216: 100 records (Total: 21600/25453)
[2025-12-02 22:57:50] 💾 Auto-saved 21600 records to meds_updated.csv (Batch 216)
[2025-12-02 22:57:53] ✓ Fetched batch 217: 100 records (Total: 21700/25453)
[2025-12-02 22:57:53] 💾 Auto-saved 21700 records to meds_updated.csv (Batch 217)
[2025-12-02 22:57:57] ✓ Fetched batch 218: 100 records (Total: 21800/25453)
[2025-12-02 22:57:57] 💾 Auto-saved 21800 records to meds_updated.csv (Batch 218)
[2025-12-02 22:58:00] ✓ Fetched batch 219: 100 records (Total: 21900/25453)
[2025-12-02 22:58:01] 💾 Auto-saved 21900 records to meds_updated.csv (Batch 219)
[2025-12-02 22:58:01]  Taking a longer break (14.0s) to simulate natural behavior...
[2025-12-02 22:58:15] ✓ Fetched batch 220: 100 records (Total: 22000/25453)
[2025-12-02 22:58:16] 💾 Auto-saved 22000 records to meds_updated.csv (Batch 220)
[2025-12-02 22:58:19] ✓ Fetched batch 221: 100 records (Total: 22100/25453)
[2025-12-02 22:58:19] 💾 Auto-saved 22100 records to meds_updated.csv (Batch 221)
[2025-12-02 22:58:22] ✓ Fetched batch 222: 100 records (Total: 22200/25453)
[2025-12-02 22:58:22] 💾 Auto-saved 22200 records to meds_updated.csv (Batch 222)
[2025-12-02 22:58:26] ✓ Fetched batch 223: 100 records (Total: 22300/25453)
[2025-12-02 22:58:26] 💾 Auto-saved 22300 records to meds_updated.csv (Batch 223)
[2025-12-02 22:58:31] ✓ Fetched batch 224: 100 records (Total: 22400/25453)
[2025-12-02 22:58:31] 💾 Auto-saved 22400 records to meds_updated.csv (Batch 224)
[2025-12-02 22:58:34] ✓ Fetched batch 225: 100 records (Total: 22500/25453)
[2025-12-02 22:58:34] 💾 Auto-saved 22500 records to meds_updated.csv (Batch 225)
[2025-12-02 22:58:39] ✓ Fetched batch 226: 100 records (Total: 22600/25453)
[2025-12-02 22:58:40] 💾 Auto-saved 22600 records to meds_updated.csv (Batch 226)
[2025-12-02 22:58:44] ✓ Fetched batch 227: 100 records (Total: 22700/25453)
[2025-12-02 22:58:45] 💾 Auto-saved 22700 records to meds_updated.csv (Batch 227)
[2025-12-02 22:58:48] ✓ Fetched batch 228: 100 records (Total: 22800/25453)
[2025-12-02 22:58:48] 💾 Auto-saved 22800 records to meds_updated.csv (Batch 228)
[2025-12-02 22:58:52] ✓ Fetched batch 229: 100 records (Total: 22900/25453)
[2025-12-02 22:58:53] 💾 Auto-saved 22900 records to meds_updated.csv (Batch 229)
[2025-12-02 22:58:53]  Taking a longer break (11.2s) to simulate natural behavior...
[2025-12-02 22:59:05] ✓ Fetched batch 230: 100 records (Total: 23000/25453)
[2025-12-02 22:59:05] 💾 Auto-saved 23000 records to meds_updated.csv (Batch 230)
[2025-12-02 22:59:10] ✓ Fetched batch 231: 100 records (Total: 23100/25453)
[2025-12-02 22:59:10] 💾 Auto-saved 23100 records to meds_updated.csv (Batch 231)
[2025-12-02 22:59:14] ✓ Fetched batch 232: 100 records (Total: 23200/25453)
[2025-12-02 22:59:15] 💾 Auto-saved 23200 records to meds_updated.csv (Batch 232)
[2025-12-02 22:59:18] ✓ Fetched batch 233: 100 records (Total: 23300/25453)
[2025-12-02 22:59:19] 💾 Auto-saved 23300 records to meds_updated.csv (Batch 233)
[2025-12-02 22:59:22] ✓ Fetched batch 234: 100 records (Total: 23400/25453)
[2025-12-02 22:59:22] 💾 Auto-saved 23400 records to meds_updated.csv (Batch 234)
[2025-12-02 22:59:27] ✓ Fetched batch 235: 100 records (Total: 23500/25453)
[2025-12-02 22:59:28] 💾 Auto-saved 23500 records to meds_updated.csv (Batch 235)
[2025-12-02 22:59:31] ✓ Fetched batch 236: 100 records (Total: 23600/25453)
[2025-12-02 22:59:32] 💾 Auto-saved 23600 records to meds_updated.csv (Batch 236)
[2025-12-02 22:59:34] ✓ Fetched batch 237: 100 records (Total: 23700/25453)
[2025-12-02 22:59:35] 💾 Auto-saved 23700 records to meds_updated.csv (Batch 237)
[2025-12-02 22:59:38] ✓ Fetched batch 238: 100 records (Total: 23800/25453)
[2025-12-02 22:59:39] 💾 Auto-saved 23800 records to meds_updated.csv (Batch 238)
[2025-12-02 22:59:43] ✓ Fetched batch 239: 100 records (Total: 23900/25453)
[2025-12-02 22:59:44] 💾 Auto-saved 23900 records to meds_updated.csv (Batch 239)
[2025-12-02 22:59:44]  Taking a longer break (10.7s) to simulate natural behavior...
[2025-12-02 22:59:55] ✓ Fetched batch 240: 100 records (Total: 24000/25453)
[2025-12-02 22:59:55] 💾 Auto-saved 24000 records to meds_updated.csv (Batch 240)
[2025-12-02 22:59:58] ✓ Fetched batch 241: 100 records (Total: 24100/25453)
[2025-12-02 22:59:59] 💾 Auto-saved 24100 records to meds_updated.csv (Batch 241)
[2025-12-02 23:00:02] ✓ Fetched batch 242: 100 records (Total: 24200/25453)
[2025-12-02 23:00:02] 💾 Auto-saved 24200 records to meds_updated.csv (Batch 242)
[2025-12-02 23:00:06] ✓ Fetched batch 243: 100 records (Total: 24300/25453)
[2025-12-02 23:00:07] 💾 Auto-saved 24300 records to meds_updated.csv (Batch 243)
[2025-12-02 23:00:10] ✓ Fetched batch 244: 100 records (Total: 24400/25453)
[2025-12-02 23:00:11] 💾 Auto-saved 24400 records to meds_updated.csv (Batch 244)
[2025-12-02 23:00:14] ✓ Fetched batch 245: 100 records (Total: 24500/25453)
[2025-12-02 23:00:14] 💾 Auto-saved 24500 records to meds_updated.csv (Batch 245)
[2025-12-02 23:00:18] ✓ Fetched batch 246: 100 records (Total: 24600/25453)
[2025-12-02 23:00:19] 💾 Auto-saved 24600 records to meds_updated.csv (Batch 246)
[2025-12-02 23:00:22] ✓ Fetched batch 247: 100 records (Total: 24700/25453)
[2025-12-02 23:00:23] 💾 Auto-saved 24700 records to meds_updated.csv (Batch 247)
[2025-12-02 23:00:28] ✓ Fetched batch 248: 100 records (Total: 24800/25453)
[2025-12-02 23:00:29] 💾 Auto-saved 24800 records to meds_updated.csv (Batch 248)
[2025-12-02 23:00:35] ✓ Fetched batch 249: 100 records (Total: 24900/25453)
[2025-12-02 23:00:36] 💾 Auto-saved 24900 records to meds_updated.csv (Batch 249)
[2025-12-02 23:00:36]  Taking a longer break (13.1s) to simulate natural behavior...
[2025-12-02 23:00:51] ✓ Fetched batch 250: 100 records (Total: 25000/25453)
[2025-12-02 23:00:51] 💾 Auto-saved 25000 records to meds_updated.csv (Batch 250)
[2025-12-02 23:00:56] ✓ Fetched batch 251: 100 records (Total: 25100/25453)
[2025-12-02 23:00:56] 💾 Auto-saved 25100 records to meds_updated.csv (Batch 251)
[2025-12-02 23:01:01] ✓ Fetched batch 252: 100 records (Total: 25200/25453)
[2025-12-02 23:01:02] 💾 Auto-saved 25200 records to meds_updated.csv (Batch 252)
[2025-12-02 23:01:05] ✓ Fetched batch 253: 100 records (Total: 25300/25453)
[2025-12-02 23:01:05] 💾 Auto-saved 25300 records to meds_updated.csv (Batch 253)
[2025-12-02 23:01:10] ✓ Fetched batch 254: 100 records (Total: 25400/25453)
[2025-12-02 23:01:10] 💾 Auto-saved 25400 records to meds_updated.csv (Batch 254)
[2025-12-02 23:01:15] ✓ Fetched batch 255: 100 records (Total: 25500/25453)
[2025-12-02 23:01:16] 💾 Auto-saved 25500 records to meds_updated.csv (Batch 255)
[2025-12-02 23:01:16] ✓ Reached target of 25453 records, stopping.
[2025-12-02 23:01:16] ✓ Scraping complete. Total records fetched: 25500
[2025-12-02 23:01:16] Processing data...
[2025-12-02 23:01:16] Saving 25500 records to meds_updated.csv...
[2025-12-02 23:01:16] ✓ Data saved successfully to meds_updated.csv
[2025-12-02 23:01:16] 
============================================================
[2025-12-02 23:01:16] SUMMARY STATISTICS
[2025-12-02 23:01:16] ============================================================
[2025-12-02 23:01:16] Total drugs scraped: 25500
[2025-12-02 23:01:17] Drugs with concentration extracted: 18642
[2025-12-02 23:01:17] Drugs with price updates: 25500
[2025-12-02 23:01:17] Unique companies: 4649
[2025-12-02 23:01:17] ============================================================
[2025-12-02 23:01:17] 
Sample of scraped data (first 5 records):
[2025-12-02 23:01:17]                          trade_name price old_price concentration last_price_update
0     tineacure 1% top. cream 20 gm    28        13            1%        02/12/2025
1                  tomex 80 tablets    85        64          None        02/12/2025
2                 sanidox gel 60 gm    65        38          60 g        02/12/2025
3            philozac 20mg 30 caps.    75        57          20mg        02/12/2025
4  zamcillus probiotic drops 10 ml    150        65         10 ml        02/12/2025
[2025-12-02 23:01:17] 
✓ SUCCESS: Scraping completed! 25500 records saved to meds_updated.csv
